{
  "id": "level_018",
  "chapter": 2,
  "boardSize": { "w": 8, "h": 8 },
  "moves": 28,
  "seed": 208,
  "spawnTable": ["earth_moss", "water_drop", "fire_ember", "wind_gust"],
  "enableFireBomb": true,
  "enableWindChime": true,
  "enableSpecialCreation": true,
  "stoneCells": [{ "x": 0, "y": 6 }, { "x": 7, "y": 6 }],
  "objectives": [
    { "type": "create_special", "target": 1, "special": "fire_bomb" },
    { "type": "collect_element", "target": 10, "element": "wind" }
  ]
}
