{
  "id": "level_007",
  "chapter": 1,
  "boardSize": { "w": 8, "h": 8 },
  "moves": 25,
  "seed": 107,
  "enableSpecialCreation": false,
  "vineCells": [
    { "x": 0, "y": 1, "layers": 1 },
    { "x": 0, "y": 2, "layers": 1 },
    { "x": 0, "y": 3, "layers": 1 },
    { "x": 0, "y": 4, "layers": 1 },
    { "x": 7, "y": 1, "layers": 1 },
    { "x": 7, "y": 2, "layers": 1 },
    { "x": 7, "y": 3, "layers": 1 },
    { "x": 7, "y": 4, "layers": 1 }
  ],
  "objectives": [{ "type": "clear_obstacle", "target": 8, "obstacle": "vine" }]
}
